No.,Time,Source,Destination,Protocol,Tag,Length,Info
1,56:55.0,100.6.0.13,100.6.0.22,TCP,1,132,"991  >  38438 [PSH, ACK] Seq=1 Ack=1 Win=85 Len=66 TSval=2220725123 TSecr=1777443977"
2,56:55.0,100.6.0.22,100.6.0.13,TCP,1,66,38438  >  991 [ACK] Seq=1 Ack=67 Win=83 Len=0 TSval=1777445072 TSecr=2220725123
3,56:55.5,100.6.0.16,100.6.0.22,TCP,1,124,"991  >  39646 [PSH, ACK] Seq=1 Ack=1 Win=85 Len=58 TSval=552499631 TSecr=2194137526"
4,56:55.5,100.6.0.22,100.6.0.16,TCP,1,66,39646  >  991 [ACK] Seq=1 Ack=59 Win=83 Len=0 TSval=2194138627 TSecr=552499631
5,56:55.6,100.6.0.15,100.6.0.22,TCP,1,96,"991  >  37484 [PSH, ACK] Seq=1 Ack=1 Win=85 Len=30 TSval=1776230594 TSecr=3277204721"
6,56:55.6,100.6.0.22,100.6.0.15,TCP,1,66,37484  >  991 [ACK] Seq=1 Ack=31 Win=83 Len=0 TSval=3277205795 TSecr=1776230594
7,56:55.8,100.6.0.12,100.6.0.22,TCP,1,112,"991  >  39224 [PSH, ACK] Seq=1 Ack=1 Win=85 Len=46 TSval=2091381336 TSecr=2650897214"
8,56:55.8,100.6.0.22,100.6.0.12,TCP,1,66,39224  >  991 [ACK] Seq=1 Ack=47 Win=83 Len=0 TSval=2650898315 TSecr=2091381336
9,56:56.0,100.6.0.11,100.6.0.22,TCP,1,112,"991  >  49370 [PSH, ACK] Seq=1 Ack=1 Win=85 Len=46 TSval=3350812610 TSecr=2773688330"
10,56:56.0,100.6.0.22,100.6.0.11,TCP,1,66,49370  >  991 [ACK] Seq=1 Ack=47 Win=83 Len=0 TSval=2773689542 TSecr=3350812610
11,56:56.1,100.6.0.14,100.6.0.22,TCP,1,112,"991  >  48900 [PSH, ACK] Seq=1 Ack=1 Win=85 Len=46 TSval=1181303231 TSecr=2456340466"
12,56:56.1,100.6.0.22,100.6.0.14,TCP,1,66,48900  >  991 [ACK] Seq=1 Ack=47 Win=83 Len=0 TSval=2456341667 TSecr=1181303231
13,56:56.3,100.6.0.13,100.6.0.22,TCP,1,132,"991  >  38438 [PSH, ACK] Seq=67 Ack=1 Win=85 Len=66 TSval=2220726362 TSecr=1777445072"
14,56:56.3,100.6.0.22,100.6.0.13,TCP,1,66,38438  >  991 [ACK] Seq=1 Ack=133 Win=83 Len=0 TSval=1777446311 TSecr=2220726362
15,56:56.7,100.6.0.15,100.6.0.22,TCP,1,96,"991  >  37484 [PSH, ACK] Seq=31 Ack=1 Win=85 Len=30 TSval=1776231605 TSecr=3277205795"
16,56:56.7,100.6.0.22,100.6.0.15,TCP,1,66,37484  >  991 [ACK] Seq=1 Ack=61 Win=83 Len=0 TSval=3277206806 TSecr=1776231605
17,56:56.7,100.6.0.16,100.6.0.22,TCP,1,124,"991  >  39646 [PSH, ACK] Seq=59 Ack=1 Win=85 Len=58 TSval=552500811 TSecr=2194138627"
18,56:56.7,100.6.0.22,100.6.0.16,TCP,1,66,39646  >  991 [ACK] Seq=1 Ack=117 Win=83 Len=0 TSval=2194139807 TSecr=552500811
19,56:56.9,100.6.0.12,100.6.0.22,TCP,1,112,"991  >  39224 [PSH, ACK] Seq=47 Ack=1 Win=85 Len=46 TSval=2091382513 TSecr=2650898315"
20,56:56.9,100.6.0.22,100.6.0.12,TCP,1,66,39224  >  991 [ACK] Seq=1 Ack=93 Win=83 Len=0 TSval=2650899492 TSecr=2091382513
21,56:57.2,100.6.0.11,100.6.0.22,TCP,1,112,"991  >  49370 [PSH, ACK] Seq=47 Ack=1 Win=85 Len=46 TSval=3350813822 TSecr=2773689542"
22,56:57.2,100.6.0.22,100.6.0.11,TCP,1,66,49370  >  991 [ACK] Seq=1 Ack=93 Win=83 Len=0 TSval=2773690754 TSecr=3350813822
23,56:57.3,100.6.0.14,100.6.0.22,TCP,1,112,"991  >  48900 [PSH, ACK] Seq=47 Ack=1 Win=85 Len=46 TSval=1181304361 TSecr=2456341667"
24,56:57.3,100.6.0.22,100.6.0.14,TCP,1,66,48900  >  991 [ACK] Seq=1 Ack=93 Win=83 Len=0 TSval=2456342797 TSecr=1181304361
25,56:57.5,100.6.0.13,100.6.0.22,TCP,1,132,"991  >  38438 [PSH, ACK] Seq=133 Ack=1 Win=85 Len=66 TSval=2220727565 TSecr=1777446311"
26,56:57.5,100.6.0.22,100.6.0.13,TCP,1,66,38438  >  991 [ACK] Seq=1 Ack=199 Win=83 Len=0 TSval=1777447514 TSecr=2220727565
27,56:57.7,100.6.0.15,100.6.0.22,TCP,1,96,"991  >  37484 [PSH, ACK] Seq=61 Ack=1 Win=85 Len=30 TSval=1776232685 TSecr=3277206806"
28,56:57.7,100.6.0.22,100.6.0.15,TCP,1,66,37484  >  991 [ACK] Seq=1 Ack=91 Win=83 Len=0 TSval=3277207886 TSecr=1776232685
29,56:57.9,100.6.0.16,100.6.0.22,TCP,1,124,"991  >  39646 [PSH, ACK] Seq=117 Ack=1 Win=85 Len=58 TSval=552501951 TSecr=2194139807"
30,56:57.9,100.6.0.22,100.6.0.16,TCP,1,66,39646  >  991 [ACK] Seq=1 Ack=175 Win=83 Len=0 TSval=2194140947 TSecr=552501951
31,56:58.1,100.6.0.12,100.6.0.22,TCP,1,112,"991  >  39224 [PSH, ACK] Seq=93 Ack=1 Win=85 Len=46 TSval=2091383637 TSecr=2650899492"
32,56:58.1,100.6.0.22,100.6.0.12,TCP,1,66,39224  >  991 [ACK] Seq=1 Ack=139 Win=83 Len=0 TSval=2650900617 TSecr=2091383637
33,56:58.3,100.6.0.11,100.6.0.22,TCP,1,112,"991  >  49370 [PSH, ACK] Seq=93 Ack=1 Win=85 Len=46 TSval=3350814979 TSecr=2773690754"
34,56:58.3,100.6.0.22,100.6.0.11,TCP,1,66,49370  >  991 [ACK] Seq=1 Ack=139 Win=83 Len=0 TSval=2773691911 TSecr=3350814979
35,56:58.4,100.6.0.14,100.6.0.22,TCP,1,112,"991  >  48900 [PSH, ACK] Seq=93 Ack=1 Win=85 Len=46 TSval=1181305484 TSecr=2456342797"
36,56:58.4,100.6.0.22,100.6.0.14,TCP,1,66,48900  >  991 [ACK] Seq=1 Ack=139 Win=83 Len=0 TSval=2456343920 TSecr=1181305484
37,56:58.9,100.6.0.15,100.6.0.22,TCP,1,96,"991  >  37484 [PSH, ACK] Seq=91 Ack=1 Win=85 Len=30 TSval=1776233798 TSecr=3277207886"
38,56:58.9,100.6.0.22,100.6.0.15,TCP,1,66,37484  >  991 [ACK] Seq=1 Ack=121 Win=83 Len=0 TSval=3277208999 TSecr=1776233798
39,56:58.9,100.6.0.13,100.6.0.22,TCP,1,132,"991  >  38438 [PSH, ACK] Seq=199 Ack=1 Win=85 Len=66 TSval=2220728963 TSecr=1777447514"
40,56:58.9,100.6.0.22,100.6.0.13,TCP,1,66,38438  >  991 [ACK] Seq=1 Ack=265 Win=83 Len=0 TSval=1777448912 TSecr=2220728963
41,56:59.0,100.6.0.16,100.6.0.22,TCP,1,124,"991  >  39646 [PSH, ACK] Seq=175 Ack=1 Win=85 Len=58 TSval=552503058 TSecr=2194140947"
42,56:59.0,100.6.0.22,100.6.0.16,TCP,1,66,39646  >  991 [ACK] Seq=1 Ack=233 Win=83 Len=0 TSval=2194142054 TSecr=552503058
43,56:59.3,100.6.0.12,100.6.0.22,TCP,1,112,"991  >  39224 [PSH, ACK] Seq=139 Ack=1 Win=85 Len=46 TSval=2091384819 TSecr=2650900617"
44,56:59.3,100.6.0.22,100.6.0.12,TCP,1,66,39224  >  991 [ACK] Seq=1 Ack=185 Win=83 Len=0 TSval=2650901798 TSecr=2091384819
45,56:59.4,100.6.0.11,100.6.0.22,TCP,1,112,"991  >  49370 [PSH, ACK] Seq=139 Ack=1 Win=85 Len=46 TSval=3350816070 TSecr=2773691911"
46,56:59.4,100.6.0.22,100.6.0.11,TCP,1,66,49370  >  991 [ACK] Seq=1 Ack=185 Win=83 Len=0 TSval=2773693002 TSecr=3350816070
47,56:59.5,100.6.0.14,100.6.0.22,TCP,1,112,"991  >  48900 [PSH, ACK] Seq=139 Ack=1 Win=85 Len=46 TSval=1181306627 TSecr=2456343920"
48,56:59.5,100.6.0.22,100.6.0.14,TCP,1,66,48900  >  991 [ACK] Seq=1 Ack=185 Win=83 Len=0 TSval=2456345063 TSecr=1181306627
49,56:59.9,100.6.0.15,100.6.0.22,TCP,1,96,"991  >  37484 [PSH, ACK] Seq=121 Ack=1 Win=85 Len=30 TSval=1776234872 TSecr=3277208999"
50,56:59.9,100.6.0.22,100.6.0.15,TCP,1,66,37484  >  991 [ACK] Seq=1 Ack=151 Win=83 Len=0 TSval=3277210073 TSecr=1776234872
51,57:00.0,100.6.0.13,100.6.0.22,TCP,1,132,"991  >  38438 [PSH, ACK] Seq=265 Ack=1 Win=85 Len=66 TSval=2220730058 TSecr=1777448912"
52,57:00.0,100.6.0.22,100.6.0.13,TCP,1,66,38438  >  991 [ACK] Seq=1 Ack=331 Win=83 Len=0 TSval=1777450007 TSecr=2220730058
53,57:00.1,100.6.0.16,100.6.0.22,TCP,1,124,"991  >  39646 [PSH, ACK] Seq=233 Ack=1 Win=85 Len=58 TSval=552504221 TSecr=2194142054"
54,57:00.1,100.6.0.22,100.6.0.16,TCP,1,66,39646  >  991 [ACK] Seq=1 Ack=291 Win=83 Len=0 TSval=2194143217 TSecr=552504221
55,57:00.3,100.6.0.12,100.6.0.22,TCP,1,112,"991  >  39224 [PSH, ACK] Seq=185 Ack=1 Win=85 Len=46 TSval=2091385885 TSecr=2650901798"
56,57:00.3,100.6.0.22,100.6.0.12,TCP,1,66,39224  >  991 [ACK] Seq=1 Ack=231 Win=83 Len=0 TSval=2650902864 TSecr=2091385885
57,57:00.5,100.6.0.11,100.6.0.22,TCP,1,112,"991  >  49370 [PSH, ACK] Seq=185 Ack=1 Win=85 Len=46 TSval=3350817128 TSecr=2773693002"
58,57:00.5,100.6.0.22,100.6.0.11,TCP,1,66,49370  >  991 [ACK] Seq=1 Ack=231 Win=83 Len=0 TSval=2773694060 TSecr=3350817128
59,57:00.6,100.6.0.14,100.6.0.22,TCP,1,112,"991  >  48900 [PSH, ACK] Seq=185 Ack=1 Win=85 Len=46 TSval=1181307647 TSecr=2456345063"
60,57:00.6,100.6.0.22,100.6.0.14,TCP,1,66,48900  >  991 [ACK] Seq=1 Ack=231 Win=83 Len=0 TSval=2456346083 TSecr=1181307647
61,57:01.0,100.6.0.15,100.6.0.22,TCP,1,96,"991  >  37484 [PSH, ACK] Seq=151 Ack=1 Win=85 Len=30 TSval=1776235910 TSecr=3277210073"
62,57:01.0,100.6.0.22,100.6.0.15,TCP,1,66,37484  >  991 [ACK] Seq=1 Ack=181 Win=83 Len=0 TSval=3277211111 TSecr=1776235910
63,57:01.0,100.6.0.13,100.6.0.22,TCP,1,132,"991  >  38438 [PSH, ACK] Seq=331 Ack=1 Win=85 Len=66 TSval=2220731124 TSecr=1777450007"
64,57:01.0,100.6.0.22,100.6.0.13,TCP,1,66,38438  >  991 [ACK] Seq=1 Ack=397 Win=83 Len=0 TSval=1777451073 TSecr=2220731124
65,57:01.2,100.6.0.16,100.6.0.22,TCP,1,124,"991  >  39646 [PSH, ACK] Seq=291 Ack=1 Win=85 Len=58 TSval=552505255 TSecr=2194143217"
66,57:01.2,100.6.0.22,100.6.0.16,TCP,1,66,39646  >  991 [ACK] Seq=1 Ack=349 Win=83 Len=0 TSval=2194144251 TSecr=552505255
67,57:01.4,100.6.0.12,100.6.0.22,TCP,1,112,"991  >  39224 [PSH, ACK] Seq=231 Ack=1 Win=85 Len=46 TSval=2091387008 TSecr=2650902864"
68,57:01.4,100.6.0.22,100.6.0.12,TCP,1,66,39224  >  991 [ACK] Seq=1 Ack=277 Win=83 Len=0 TSval=2650903987 TSecr=2091387008
69,57:01.5,100.6.0.11,100.6.0.22,TCP,1,112,"991  >  49370 [PSH, ACK] Seq=231 Ack=1 Win=85 Len=46 TSval=3350818163 TSecr=2773694060"
70,57:01.5,100.6.0.22,100.6.0.11,TCP,1,66,49370  >  991 [ACK] Seq=1 Ack=277 Win=83 Len=0 TSval=2773695095 TSecr=3350818163
71,57:01.7,100.6.0.14,100.6.0.22,TCP,1,112,"991  >  48900 [PSH, ACK] Seq=231 Ack=1 Win=85 Len=46 TSval=1181308824 TSecr=2456346083"
72,57:01.7,100.6.0.22,100.6.0.14,TCP,1,66,48900  >  991 [ACK] Seq=1 Ack=277 Win=83 Len=0 TSval=2456347260 TSecr=1181308824
73,57:02.0,100.6.0.15,100.6.0.22,TCP,1,96,"991  >  37484 [PSH, ACK] Seq=181 Ack=1 Win=85 Len=30 TSval=1776236960 TSecr=3277211111"
74,57:02.0,100.6.0.22,100.6.0.15,TCP,1,66,37484  >  991 [ACK] Seq=1 Ack=211 Win=83 Len=0 TSval=3277212161 TSecr=1776236960
75,57:02.2,100.6.0.13,100.6.0.22,TCP,1,132,"991  >  38438 [PSH, ACK] Seq=397 Ack=1 Win=85 Len=66 TSval=2220732237 TSecr=1777451073"
76,57:02.2,100.6.0.22,100.6.0.13,TCP,1,66,38438  >  991 [ACK] Seq=1 Ack=463 Win=83 Len=0 TSval=1777452186 TSecr=2220732237
77,57:02.2,100.6.0.16,100.6.0.22,TCP,1,124,"991  >  39646 [PSH, ACK] Seq=349 Ack=1 Win=85 Len=58 TSval=552506337 TSecr=2194144251"
78,57:02.2,100.6.0.22,100.6.0.16,TCP,1,66,39646  >  991 [ACK] Seq=1 Ack=407 Win=83 Len=0 TSval=2194145333 TSecr=552506337
79,57:02.5,100.6.0.12,100.6.0.22,TCP,1,112,"991  >  39224 [PSH, ACK] Seq=277 Ack=1 Win=85 Len=46 TSval=2091388100 TSecr=2650903987"
80,57:02.5,100.6.0.22,100.6.0.12,TCP,1,66,39224  >  991 [ACK] Seq=1 Ack=323 Win=83 Len=0 TSval=2650905079 TSecr=2091388100
81,57:02.5,100.6.0.11,100.6.0.22,TCP,1,112,"991  >  49370 [PSH, ACK] Seq=277 Ack=1 Win=85 Len=46 TSval=3350819177 TSecr=2773695095"
82,57:02.5,100.6.0.22,100.6.0.11,TCP,1,66,49370  >  991 [ACK] Seq=1 Ack=323 Win=83 Len=0 TSval=2773696109 TSecr=3350819177
83,57:02.7,100.6.0.14,100.6.0.22,TCP,1,112,"991  >  48900 [PSH, ACK] Seq=277 Ack=1 Win=85 Len=46 TSval=1181309843 TSecr=2456347260"
84,57:02.7,100.6.0.22,100.6.0.14,TCP,1,66,48900  >  991 [ACK] Seq=1 Ack=323 Win=83 Len=0 TSval=2456348279 TSecr=1181309843
85,57:03.0,100.6.0.15,100.6.0.22,TCP,1,96,"991  >  37484 [PSH, ACK] Seq=211 Ack=1 Win=85 Len=30 TSval=1776237983 TSecr=3277212161"
86,57:03.0,100.6.0.22,100.6.0.15,TCP,1,66,37484  >  991 [ACK] Seq=1 Ack=241 Win=83 Len=0 TSval=3277213184 TSecr=1776237983
87,57:03.2,100.6.0.13,100.6.0.22,TCP,1,132,"991  >  38438 [PSH, ACK] Seq=463 Ack=1 Win=85 Len=66 TSval=2220733326 TSecr=1777452186"
88,57:03.2,100.6.0.22,100.6.0.13,TCP,1,66,38438  >  991 [ACK] Seq=1 Ack=529 Win=83 Len=0 TSval=1777453275 TSecr=2220733326
89,57:03.4,100.6.0.16,100.6.0.22,TCP,1,124,"991  >  39646 [PSH, ACK] Seq=407 Ack=1 Win=85 Len=58 TSval=552507468 TSecr=2194145333"
90,57:03.4,100.6.0.22,100.6.0.16,TCP,1,66,39646  >  991 [ACK] Seq=1 Ack=465 Win=83 Len=0 TSval=2194146465 TSecr=552507468
91,57:03.5,100.6.0.12,100.6.0.22,TCP,1,112,"991  >  39224 [PSH, ACK] Seq=323 Ack=1 Win=85 Len=46 TSval=2091389117 TSecr=2650905079"
92,57:03.5,100.6.0.22,100.6.0.12,TCP,1,66,39224  >  991 [ACK] Seq=1 Ack=369 Win=83 Len=0 TSval=2650906096 TSecr=2091389117
93,57:03.7,100.6.0.11,100.6.0.22,TCP,1,112,"991  >  49370 [PSH, ACK] Seq=323 Ack=1 Win=85 Len=46 TSval=3350820374 TSecr=2773696109"
94,57:03.7,100.6.0.22,100.6.0.11,TCP,1,66,49370  >  991 [ACK] Seq=1 Ack=369 Win=83 Len=0 TSval=2773697306 TSecr=3350820374
95,57:03.8,100.6.0.14,100.6.0.22,TCP,1,112,"991  >  48900 [PSH, ACK] Seq=323 Ack=1 Win=85 Len=46 TSval=1181310922 TSecr=2456348279"
96,57:03.8,100.6.0.22,100.6.0.14,TCP,1,66,48900  >  991 [ACK] Seq=1 Ack=369 Win=83 Len=0 TSval=2456349358 TSecr=1181310922
97,57:04.1,100.6.0.15,100.6.0.22,TCP,1,96,"991  >  37484 [PSH, ACK] Seq=241 Ack=1 Win=85 Len=30 TSval=1776239019 TSecr=3277213184"
98,57:04.1,100.6.0.22,100.6.0.15,TCP,1,66,37484  >  991 [ACK] Seq=1 Ack=271 Win=83 Len=0 TSval=3277214220 TSecr=1776239019
99,57:04.3,100.6.0.13,100.6.0.22,TCP,1,132,"991  >  38438 [PSH, ACK] Seq=529 Ack=1 Win=85 Len=66 TSval=2220734419 TSecr=1777453275"
100,57:04.3,100.6.0.22,100.6.0.13,TCP,1,66,38438  >  991 [ACK] Seq=1 Ack=595 Win=83 Len=0 TSval=1777454368 TSecr=2220734419
101,57:04.6,100.6.0.12,100.6.0.22,TCP,1,112,"991  >  39224 [PSH, ACK] Seq=369 Ack=1 Win=85 Len=46 TSval=2091390143 TSecr=2650906096"
102,57:04.6,100.6.0.22,100.6.0.12,TCP,1,66,39224  >  991 [ACK] Seq=1 Ack=415 Win=83 Len=0 TSval=2650907122 TSecr=2091390143
103,57:04.6,100.6.0.16,100.6.0.22,TCP,1,124,"991  >  39646 [PSH, ACK] Seq=465 Ack=1 Win=85 Len=58 TSval=552508703 TSecr=2194146465"
104,57:04.6,100.6.0.22,100.6.0.16,TCP,1,66,39646  >  991 [ACK] Seq=1 Ack=523 Win=83 Len=0 TSval=2194147699 TSecr=552508703
105,57:04.8,100.6.0.11,100.6.0.22,TCP,1,112,"991  >  49370 [PSH, ACK] Seq=369 Ack=1 Win=85 Len=46 TSval=3350821398 TSecr=2773697306"
106,57:04.8,100.6.0.22,100.6.0.11,TCP,1,66,49370  >  991 [ACK] Seq=1 Ack=415 Win=83 Len=0 TSval=2773698330 TSecr=3350821398
107,57:04.8,100.6.0.14,100.6.0.22,TCP,1,112,"991  >  48900 [PSH, ACK] Seq=369 Ack=1 Win=85 Len=46 TSval=1181311945 TSecr=2456349358"
108,57:04.8,100.6.0.22,100.6.0.14,TCP,1,66,48900  >  991 [ACK] Seq=1 Ack=415 Win=83 Len=0 TSval=2456350381 TSecr=1181311945
109,57:05.1,100.6.0.15,100.6.0.22,TCP,1,96,"991  >  37484 [PSH, ACK] Seq=271 Ack=1 Win=85 Len=30 TSval=1776240028 TSecr=3277214220"
110,57:05.1,100.6.0.22,100.6.0.15,TCP,1,66,37484  >  991 [ACK] Seq=1 Ack=301 Win=83 Len=0 TSval=3277215229 TSecr=1776240028
111,57:05.4,100.6.0.13,100.6.0.22,TCP,1,132,"991  >  38438 [PSH, ACK] Seq=595 Ack=1 Win=85 Len=66 TSval=2220735446 TSecr=1777454368"
112,57:05.4,100.6.0.22,100.6.0.13,TCP,1,66,38438  >  991 [ACK] Seq=1 Ack=661 Win=83 Len=0 TSval=1777455395 TSecr=2220735446
113,57:05.6,100.6.0.16,100.6.0.22,TCP,1,124,"991  >  39646 [PSH, ACK] Seq=523 Ack=1 Win=85 Len=58 TSval=552509730 TSecr=2194147699"
114,57:05.6,100.6.0.22,100.6.0.16,TCP,1,66,39646  >  991 [ACK] Seq=1 Ack=581 Win=83 Len=0 TSval=2194148726 TSecr=552509730
115,57:05.7,100.6.0.12,100.6.0.22,TCP,1,112,"991  >  39224 [PSH, ACK] Seq=415 Ack=1 Win=85 Len=46 TSval=2091391229 TSecr=2650907122"
116,57:05.7,100.6.0.22,100.6.0.12,TCP,1,66,39224  >  991 [ACK] Seq=1 Ack=461 Win=83 Len=0 TSval=2650908208 TSecr=2091391229
117,57:05.8,100.6.0.11,100.6.0.22,TCP,1,112,"991  >  49370 [PSH, ACK] Seq=415 Ack=1 Win=85 Len=46 TSval=3350822479 TSecr=2773698330"
118,57:05.8,100.6.0.22,100.6.0.11,TCP,1,66,49370  >  991 [ACK] Seq=1 Ack=461 Win=83 Len=0 TSval=2773699411 TSecr=3350822479
119,57:05.9,100.6.0.14,100.6.0.22,TCP,1,112,"991  >  48900 [PSH, ACK] Seq=415 Ack=1 Win=85 Len=46 TSval=1181312961 TSecr=2456350381"
120,57:05.9,100.6.0.22,100.6.0.14,TCP,1,66,48900  >  991 [ACK] Seq=1 Ack=461 Win=83 Len=0 TSval=2456351397 TSecr=1181312961
121,57:06.1,100.6.0.15,100.6.0.22,TCP,1,96,"991  >  37484 [PSH, ACK] Seq=301 Ack=1 Win=85 Len=30 TSval=1776241075 TSecr=3277215229"
122,57:06.1,100.6.0.22,100.6.0.15,TCP,1,66,37484  >  991 [ACK] Seq=1 Ack=331 Win=83 Len=0 TSval=3277216276 TSecr=1776241075
123,57:06.5,100.6.0.13,100.6.0.22,TCP,1,132,"991  >  38438 [PSH, ACK] Seq=661 Ack=1 Win=85 Len=66 TSval=2220736538 TSecr=1777455395"
124,57:06.5,100.6.0.22,100.6.0.13,TCP,1,66,38438  >  991 [ACK] Seq=1 Ack=727 Win=83 Len=0 TSval=1777456487 TSecr=2220736538
125,57:06.7,100.6.0.12,100.6.0.22,TCP,1,112,"991  >  39224 [PSH, ACK] Seq=461 Ack=1 Win=85 Len=46 TSval=2091392247 TSecr=2650908208"
126,57:06.7,100.6.0.22,100.6.0.12,TCP,1,66,39224  >  991 [ACK] Seq=1 Ack=507 Win=83 Len=0 TSval=2650909226 TSecr=2091392247
127,57:06.8,100.6.0.16,100.6.0.22,TCP,1,124,"991  >  39646 [PSH, ACK] Seq=581 Ack=1 Win=85 Len=58 TSval=552510932 TSecr=2194148726"
128,57:06.8,100.6.0.22,100.6.0.16,TCP,1,66,39646  >  991 [ACK] Seq=1 Ack=639 Win=83 Len=0 TSval=2194149928 TSecr=552510932
129,57:06.9,100.6.0.11,100.6.0.22,TCP,1,112,"991  >  49370 [PSH, ACK] Seq=461 Ack=1 Win=85 Len=46 TSval=3350823569 TSecr=2773699411"
130,57:06.9,100.6.0.22,100.6.0.11,TCP,1,66,49370  >  991 [ACK] Seq=1 Ack=507 Win=83 Len=0 TSval=2773700501 TSecr=3350823569
131,57:07.0,100.6.0.14,100.6.0.22,TCP,1,112,"991  >  48900 [PSH, ACK] Seq=461 Ack=1 Win=85 Len=46 TSval=1181314111 TSecr=2456351397"
132,57:07.0,100.6.0.22,100.6.0.14,TCP,1,66,48900  >  991 [ACK] Seq=1 Ack=507 Win=83 Len=0 TSval=2456352547 TSecr=1181314111
133,57:07.1,100.6.0.15,100.6.0.22,TCP,1,96,"991  >  37484 [PSH, ACK] Seq=331 Ack=1 Win=85 Len=30 TSval=1776242094 TSecr=3277216276"
134,57:07.1,100.6.0.22,100.6.0.15,TCP,1,66,37484  >  991 [ACK] Seq=1 Ack=361 Win=83 Len=0 TSval=3277217295 TSecr=1776242094
135,57:07.6,100.6.0.13,100.6.0.22,TCP,1,132,"991  >  38438 [PSH, ACK] Seq=727 Ack=1 Win=85 Len=66 TSval=2220737643 TSecr=1777456487"
136,57:07.6,100.6.0.22,100.6.0.13,TCP,1,66,38438  >  991 [ACK] Seq=1 Ack=793 Win=83 Len=0 TSval=1777457592 TSecr=2220737643
137,57:07.8,100.6.0.12,100.6.0.22,TCP,1,112,"991  >  39224 [PSH, ACK] Seq=507 Ack=1 Win=85 Len=46 TSval=2091393397 TSecr=2650909226"
138,57:07.8,100.6.0.22,100.6.0.12,TCP,1,66,39224  >  991 [ACK] Seq=1 Ack=553 Win=83 Len=0 TSval=2650910376 TSecr=2091393397
139,57:08.0,100.6.0.16,100.6.0.22,TCP,1,124,"991  >  39646 [PSH, ACK] Seq=639 Ack=1 Win=85 Len=58 TSval=552512074 TSecr=2194149928"
140,57:08.0,100.6.0.22,100.6.0.16,TCP,1,66,39646  >  991 [ACK] Seq=1 Ack=697 Win=83 Len=0 TSval=2194151070 TSecr=552512074
141,57:08.0,100.6.0.11,100.6.0.22,TCP,1,112,"991  >  49370 [PSH, ACK] Seq=507 Ack=1 Win=85 Len=46 TSval=3350824645 TSecr=2773700501"
142,57:08.0,100.6.0.22,100.6.0.11,TCP,1,66,49370  >  991 [ACK] Seq=1 Ack=553 Win=83 Len=0 TSval=2773701577 TSecr=3350824645
143,57:08.0,100.6.0.14,100.6.0.22,TCP,1,112,"991  >  48900 [PSH, ACK] Seq=507 Ack=1 Win=85 Len=46 TSval=1181315140 TSecr=2456352547"
144,57:08.0,100.6.0.22,100.6.0.14,TCP,1,66,48900  >  991 [ACK] Seq=1 Ack=553 Win=83 Len=0 TSval=2456353576 TSecr=1181315140
145,57:08.2,100.6.0.15,100.6.0.22,TCP,1,96,"991  >  37484 [PSH, ACK] Seq=361 Ack=1 Win=85 Len=30 TSval=1776243164 TSecr=3277217295"
146,57:08.2,100.6.0.22,100.6.0.15,TCP,1,66,37484  >  991 [ACK] Seq=1 Ack=391 Win=83 Len=0 TSval=3277218365 TSecr=1776243164
147,57:08.6,100.6.0.13,100.6.0.22,TCP,1,132,"991  >  38438 [PSH, ACK] Seq=793 Ack=1 Win=85 Len=66 TSval=2220738730 TSecr=1777457592"
148,57:08.6,100.6.0.22,100.6.0.13,TCP,1,66,38438  >  991 [ACK] Seq=1 Ack=859 Win=83 Len=0 TSval=1777458679 TSecr=2220738730
149,57:08.9,100.6.0.12,100.6.0.22,TCP,1,112,"991  >  39224 [PSH, ACK] Seq=553 Ack=1 Win=85 Len=46 TSval=2091394433 TSecr=2650910376"
150,57:08.9,100.6.0.22,100.6.0.12,TCP,1,66,39224  >  991 [ACK] Seq=1 Ack=599 Win=83 Len=0 TSval=2650911412 TSecr=2091394433
151,57:09.0,100.6.0.16,100.6.0.22,TCP,1,124,"991  >  39646 [PSH, ACK] Seq=697 Ack=1 Win=85 Len=58 TSval=552513143 TSecr=2194151070"
152,57:09.0,100.6.0.22,100.6.0.16,TCP,1,66,39646  >  991 [ACK] Seq=1 Ack=755 Win=83 Len=0 TSval=2194152139 TSecr=552513143
153,57:09.1,100.6.0.11,100.6.0.22,TCP,1,112,"991  >  49370 [PSH, ACK] Seq=553 Ack=1 Win=85 Len=46 TSval=3350825754 TSecr=2773701577"
154,57:09.1,100.6.0.22,100.6.0.11,TCP,1,66,49370  >  991 [ACK] Seq=1 Ack=599 Win=83 Len=0 TSval=2773702686 TSecr=3350825754
155,57:09.2,100.6.0.14,100.6.0.22,TCP,1,112,"991  >  48900 [PSH, ACK] Seq=553 Ack=1 Win=85 Len=46 TSval=1181316260 TSecr=2456353576"
156,57:09.2,100.6.0.22,100.6.0.14,TCP,1,66,48900  >  991 [ACK] Seq=1 Ack=599 Win=83 Len=0 TSval=2456354696 TSecr=1181316260
157,57:09.2,100.6.0.15,100.6.0.22,TCP,1,96,"991  >  37484 [PSH, ACK] Seq=391 Ack=1 Win=85 Len=30 TSval=1776244173 TSecr=3277218365"
158,57:09.2,100.6.0.22,100.6.0.15,TCP,1,66,37484  >  991 [ACK] Seq=1 Ack=421 Win=83 Len=0 TSval=3277219374 TSecr=1776244173
159,57:09.7,100.6.0.13,100.6.0.22,TCP,1,132,"991  >  38438 [PSH, ACK] Seq=859 Ack=1 Win=85 Len=66 TSval=2220739823 TSecr=1777458679"
160,57:09.7,100.6.0.22,100.6.0.13,TCP,1,66,38438  >  991 [ACK] Seq=1 Ack=925 Win=83 Len=0 TSval=1777459772 TSecr=2220739823
161,57:10.0,100.6.0.12,100.6.0.22,TCP,1,112,"991  >  39224 [PSH, ACK] Seq=599 Ack=1 Win=85 Len=46 TSval=2091395537 TSecr=2650911412"
162,57:10.0,100.6.0.22,100.6.0.12,TCP,1,66,39224  >  991 [ACK] Seq=1 Ack=645 Win=83 Len=0 TSval=2650912516 TSecr=2091395537
163,57:10.1,100.6.0.16,100.6.0.22,TCP,1,124,"991  >  39646 [PSH, ACK] Seq=755 Ack=1 Win=85 Len=58 TSval=552514175 TSecr=2194152139"
164,57:10.1,100.6.0.22,100.6.0.16,TCP,1,66,39646  >  991 [ACK] Seq=1 Ack=813 Win=83 Len=0 TSval=2194153171 TSecr=552514175
165,57:10.2,100.6.0.11,100.6.0.22,TCP,1,112,"991  >  49370 [PSH, ACK] Seq=599 Ack=1 Win=85 Len=46 TSval=3350826787 TSecr=2773702686"
166,57:10.2,100.6.0.22,100.6.0.11,TCP,1,66,49370  >  991 [ACK] Seq=1 Ack=645 Win=83 Len=0 TSval=2773703719 TSecr=3350826787
167,57:10.3,100.6.0.15,100.6.0.22,TCP,1,96,"991  >  37484 [PSH, ACK] Seq=421 Ack=1 Win=85 Len=30 TSval=1776245217 TSecr=3277219374"
168,57:10.3,100.6.0.22,100.6.0.15,TCP,1,66,37484  >  991 [ACK] Seq=1 Ack=451 Win=83 Len=0 TSval=3277220418 TSecr=1776245217
169,57:10.3,100.6.0.14,100.6.0.22,TCP,1,112,"991  >  48900 [PSH, ACK] Seq=599 Ack=1 Win=85 Len=46 TSval=1181317408 TSecr=2456354696"
170,57:10.3,100.6.0.22,100.6.0.14,TCP,1,66,48900  >  991 [ACK] Seq=1 Ack=645 Win=83 Len=0 TSval=2456355844 TSecr=1181317408
171,57:10.8,100.6.0.13,100.6.0.22,TCP,1,132,"991  >  38438 [PSH, ACK] Seq=925 Ack=1 Win=85 Len=66 TSval=2220740925 TSecr=1777459772"
172,57:10.8,100.6.0.22,100.6.0.13,TCP,1,66,38438  >  991 [ACK] Seq=1 Ack=991 Win=83 Len=0 TSval=1777460874 TSecr=2220740925
173,57:11.1,100.6.0.16,100.6.0.22,TCP,1,124,"991  >  39646 [PSH, ACK] Seq=813 Ack=1 Win=85 Len=58 TSval=552515242 TSecr=2194153171"
174,57:11.1,100.6.0.22,100.6.0.16,TCP,1,66,39646  >  991 [ACK] Seq=1 Ack=871 Win=83 Len=0 TSval=2194154238 TSecr=552515242
175,57:11.2,100.6.0.12,100.6.0.22,TCP,1,112,"991  >  39224 [PSH, ACK] Seq=645 Ack=1 Win=85 Len=46 TSval=2091396725 TSecr=2650912516"
176,57:11.2,100.6.0.22,100.6.0.12,TCP,1,66,39224  >  991 [ACK] Seq=1 Ack=691 Win=83 Len=0 TSval=2650913704 TSecr=2091396725
177,57:11.2,100.6.0.11,100.6.0.22,TCP,1,112,"991  >  49370 [PSH, ACK] Seq=645 Ack=1 Win=85 Len=46 TSval=3350827859 TSecr=2773703719"
178,57:11.2,100.6.0.22,100.6.0.11,TCP,1,66,49370  >  991 [ACK] Seq=1 Ack=691 Win=83 Len=0 TSval=2773704791 TSecr=3350827859
179,57:11.3,100.6.0.15,100.6.0.22,TCP,1,96,"991  >  37484 [PSH, ACK] Seq=451 Ack=1 Win=85 Len=30 TSval=1776246284 TSecr=3277220418"
180,57:11.3,100.6.0.22,100.6.0.15,TCP,1,66,37484  >  991 [ACK] Seq=1 Ack=481 Win=83 Len=0 TSval=3277221485 TSecr=1776246284
181,57:11.4,100.6.0.14,100.6.0.22,TCP,1,112,"991  >  48900 [PSH, ACK] Seq=645 Ack=1 Win=85 Len=46 TSval=1181318512 TSecr=2456355844"
182,57:11.4,100.6.0.22,100.6.0.14,TCP,1,66,48900  >  991 [ACK] Seq=1 Ack=691 Win=83 Len=0 TSval=2456356948 TSecr=1181318512
183,57:12.0,100.6.0.13,100.6.0.22,TCP,1,132,"991  >  38438 [PSH, ACK] Seq=991 Ack=1 Win=85 Len=66 TSval=2220742127 TSecr=1777460874"
184,57:12.0,100.6.0.22,100.6.0.13,TCP,1,66,38438  >  991 [ACK] Seq=1 Ack=1057 Win=83 Len=0 TSval=1777462076 TSecr=2220742127
185,57:12.3,100.6.0.12,100.6.0.22,TCP,1,112,"991  >  39224 [PSH, ACK] Seq=691 Ack=1 Win=85 Len=46 TSval=2091397829 TSecr=2650913704"
186,57:12.3,100.6.0.22,100.6.0.12,TCP,1,66,39224  >  991 [ACK] Seq=1 Ack=737 Win=83 Len=0 TSval=2650914808 TSecr=2091397829
187,57:12.3,100.6.0.11,100.6.0.22,TCP,1,112,"991  >  49370 [PSH, ACK] Seq=691 Ack=1 Win=85 Len=46 TSval=3350828954 TSecr=2773704791"
188,57:12.3,100.6.0.22,100.6.0.11,TCP,1,66,49370  >  991 [ACK] Seq=1 Ack=737 Win=83 Len=0 TSval=2773705886 TSecr=3350828954
189,57:12.3,100.6.0.15,100.6.0.22,TCP,1,96,"991  >  37484 [PSH, ACK] Seq=481 Ack=1 Win=85 Len=30 TSval=1776247293 TSecr=3277221485"
190,57:12.3,100.6.0.22,100.6.0.15,TCP,1,66,37484  >  991 [ACK] Seq=1 Ack=511 Win=83 Len=0 TSval=3277222494 TSecr=1776247293
191,57:12.4,100.6.0.16,100.6.0.22,TCP,1,124,"991  >  39646 [PSH, ACK] Seq=871 Ack=1 Win=85 Len=58 TSval=552516459 TSecr=2194154238"
192,57:12.4,100.6.0.22,100.6.0.16,TCP,1,66,39646  >  991 [ACK] Seq=1 Ack=929 Win=83 Len=0 TSval=2194155455 TSecr=552516459
193,57:12.4,100.6.0.14,100.6.0.22,TCP,1,112,"991  >  48900 [PSH, ACK] Seq=691 Ack=1 Win=85 Len=46 TSval=1181319545 TSecr=2456356948"
194,57:12.4,100.6.0.22,100.6.0.14,TCP,1,66,48900  >  991 [ACK] Seq=1 Ack=737 Win=83 Len=0 TSval=2456357981 TSecr=1181319545
195,57:13.1,100.6.0.13,100.6.0.22,TCP,1,132,"991  >  38438 [PSH, ACK] Seq=1057 Ack=1 Win=85 Len=66 TSval=2220743148 TSecr=1777462076"
196,57:13.1,100.6.0.22,100.6.0.13,TCP,1,66,38438  >  991 [ACK] Seq=1 Ack=1123 Win=83 Len=0 TSval=1777463097 TSecr=2220743148
197,57:13.3,100.6.0.12,100.6.0.22,TCP,1,112,"991  >  39224 [PSH, ACK] Seq=737 Ack=1 Win=85 Len=46 TSval=2091398843 TSecr=2650914808"
198,57:13.3,100.6.0.22,100.6.0.12,TCP,1,66,39224  >  991 [ACK] Seq=1 Ack=783 Win=83 Len=0 TSval=2650915822 TSecr=2091398843
199,57:13.4,100.6.0.15,100.6.0.22,TCP,1,96,"991  >  37484 [PSH, ACK] Seq=511 Ack=1 Win=85 Len=30 TSval=1776248373 TSecr=3277222494"
200,57:13.4,100.6.0.22,100.6.0.15,TCP,1,66,37484  >  991 [ACK] Seq=1 Ack=541 Win=83 Len=0 TSval=3277223575 TSecr=1776248373
201,57:13.5,100.6.0.11,100.6.0.22,TCP,1,112,"991  >  49370 [PSH, ACK] Seq=737 Ack=1 Win=85 Len=46 TSval=3350830125 TSecr=2773705886"
202,57:13.5,100.6.0.22,100.6.0.11,TCP,1,66,49370  >  991 [ACK] Seq=1 Ack=783 Win=83 Len=0 TSval=2773707057 TSecr=3350830125
203,57:13.5,100.6.0.16,100.6.0.22,TCP,1,124,"991  >  39646 [PSH, ACK] Seq=929 Ack=1 Win=85 Len=58 TSval=552517639 TSecr=2194155455"
204,57:13.5,100.6.0.22,100.6.0.16,TCP,1,66,39646  >  991 [ACK] Seq=1 Ack=987 Win=83 Len=0 TSval=2194156635 TSecr=552517639
205,57:13.6,100.6.0.14,100.6.0.22,TCP,1,112,"991  >  48900 [PSH, ACK] Seq=737 Ack=1 Win=85 Len=46 TSval=1181320745 TSecr=2456357981"
206,57:13.6,100.6.0.22,100.6.0.14,TCP,1,66,48900  >  991 [ACK] Seq=1 Ack=783 Win=83 Len=0 TSval=2456359181 TSecr=1181320745
207,57:14.2,100.6.0.13,100.6.0.22,TCP,1,132,"991  >  38438 [PSH, ACK] Seq=1123 Ack=1 Win=85 Len=66 TSval=2220744240 TSecr=1777463097"
208,57:14.2,100.6.0.22,100.6.0.13,TCP,1,66,38438  >  991 [ACK] Seq=1 Ack=1189 Win=83 Len=0 TSval=1777464189 TSecr=2220744240
209,57:14.4,100.6.0.15,100.6.0.22,TCP,1,96,"991  >  37484 [PSH, ACK] Seq=541 Ack=1 Win=85 Len=30 TSval=1776249382 TSecr=3277223575"
210,57:14.4,100.6.0.22,100.6.0.15,TCP,1,66,37484  >  991 [ACK] Seq=1 Ack=571 Win=83 Len=0 TSval=3277224583 TSecr=1776249382
211,57:14.5,100.6.0.12,100.6.0.22,TCP,1,112,"991  >  39224 [PSH, ACK] Seq=783 Ack=1 Win=85 Len=46 TSval=2091400033 TSecr=2650915822"
212,57:14.5,100.6.0.22,100.6.0.12,TCP,1,66,39224  >  991 [ACK] Seq=1 Ack=829 Win=83 Len=0 TSval=2650917012 TSecr=2091400033
213,57:14.7,100.6.0.16,100.6.0.22,TCP,1,124,"991  >  39646 [PSH, ACK] Seq=987 Ack=1 Win=85 Len=58 TSval=552518822 TSecr=2194156635"
214,57:14.7,100.6.0.22,100.6.0.16,TCP,1,66,39646  >  991 [ACK] Seq=1 Ack=1045 Win=83 Len=0 TSval=2194157818 TSecr=552518822
215,57:14.7,100.6.0.11,100.6.0.22,TCP,1,112,"991  >  49370 [PSH, ACK] Seq=783 Ack=1 Win=85 Len=46 TSval=3350831365 TSecr=2773707057"
216,57:14.7,100.6.0.22,100.6.0.11,TCP,1,66,49370  >  991 [ACK] Seq=1 Ack=829 Win=83 Len=0 TSval=2773708297 TSecr=3350831365
217,57:14.7,100.6.0.14,100.6.0.22,TCP,1,112,"991  >  48900 [PSH, ACK] Seq=783 Ack=1 Win=85 Len=46 TSval=1181321838 TSecr=2456359181"
218,57:14.7,100.6.0.22,100.6.0.14,TCP,1,66,48900  >  991 [ACK] Seq=1 Ack=829 Win=83 Len=0 TSval=2456360274 TSecr=1181321838
219,57:15.4,100.6.0.13,100.6.0.22,TCP,1,132,"991  >  38438 [PSH, ACK] Seq=1189 Ack=1 Win=85 Len=66 TSval=2220745478 TSecr=1777464189"
220,57:15.4,100.6.0.22,100.6.0.13,TCP,1,66,38438  >  991 [ACK] Seq=1 Ack=1255 Win=83 Len=0 TSval=1777465427 TSecr=2220745478
221,57:15.4,100.6.0.15,100.6.0.22,TCP,1,96,"991  >  37484 [PSH, ACK] Seq=571 Ack=1 Win=85 Len=30 TSval=1776250391 TSecr=3277224583"
222,57:15.4,100.6.0.22,100.6.0.15,TCP,1,66,37484  >  991 [ACK] Seq=1 Ack=601 Win=83 Len=0 TSval=3277225592 TSecr=1776250391
223,57:15.7,100.6.0.12,100.6.0.22,TCP,1,112,"991  >  39224 [PSH, ACK] Seq=829 Ack=1 Win=85 Len=46 TSval=2091401233 TSecr=2650917012"
224,57:15.7,100.6.0.22,100.6.0.12,TCP,1,66,39224  >  991 [ACK] Seq=1 Ack=875 Win=83 Len=0 TSval=2650918212 TSecr=2091401233
225,57:15.7,100.6.0.16,100.6.0.22,TCP,1,124,"991  >  39646 [PSH, ACK] Seq=1045 Ack=1 Win=85 Len=58 TSval=552519838 TSecr=2194157818"
226,57:15.7,100.6.0.22,100.6.0.16,TCP,1,66,39646  >  991 [ACK] Seq=1 Ack=1103 Win=83 Len=0 TSval=2194158834 TSecr=552519838
227,57:15.8,100.6.0.11,100.6.0.22,TCP,1,112,"991  >  49370 [PSH, ACK] Seq=829 Ack=1 Win=85 Len=46 TSval=3350832395 TSecr=2773708297"
228,57:15.8,100.6.0.22,100.6.0.11,TCP,1,66,49370  >  991 [ACK] Seq=1 Ack=875 Win=83 Len=0 TSval=2773709327 TSecr=3350832395
229,57:15.9,100.6.0.14,100.6.0.22,TCP,1,112,"991  >  48900 [PSH, ACK] Seq=829 Ack=1 Win=85 Len=46 TSval=1181323024 TSecr=2456360274"
230,57:15.9,100.6.0.22,100.6.0.14,TCP,1,66,48900  >  991 [ACK] Seq=1 Ack=875 Win=83 Len=0 TSval=2456361460 TSecr=1181323024
231,57:16.5,100.6.0.15,100.6.0.22,TCP,1,96,"991  >  37484 [PSH, ACK] Seq=601 Ack=1 Win=85 Len=30 TSval=1776251401 TSecr=3277225592"
232,57:16.5,100.6.0.22,100.6.0.15,TCP,1,66,37484  >  991 [ACK] Seq=1 Ack=631 Win=83 Len=0 TSval=3277226602 TSecr=1776251401
233,57:16.5,100.6.0.13,100.6.0.22,TCP,1,132,"991  >  38438 [PSH, ACK] Seq=1255 Ack=1 Win=85 Len=66 TSval=2220746569 TSecr=1777465427"
234,57:16.5,100.6.0.22,100.6.0.13,TCP,1,66,38438  >  991 [ACK] Seq=1 Ack=1321 Win=83 Len=0 TSval=1777466518 TSecr=2220746569
235,57:16.8,100.6.0.12,100.6.0.22,TCP,1,112,"991  >  39224 [PSH, ACK] Seq=875 Ack=1 Win=85 Len=46 TSval=2091402394 TSecr=2650918212"
236,57:16.8,100.6.0.22,100.6.0.12,TCP,1,66,39224  >  991 [ACK] Seq=1 Ack=921 Win=83 Len=0 TSval=2650919373 TSecr=2091402394
237,57:16.8,100.6.0.16,100.6.0.22,TCP,1,124,"991  >  39646 [PSH, ACK] Seq=1103 Ack=1 Win=85 Len=58 TSval=552520929 TSecr=2194158834"
238,57:16.8,100.6.0.22,100.6.0.16,TCP,1,66,39646  >  991 [ACK] Seq=1 Ack=1161 Win=83 Len=0 TSval=2194159925 TSecr=552520929
239,57:16.8,100.6.0.11,100.6.0.22,TCP,1,112,"991  >  49370 [PSH, ACK] Seq=875 Ack=1 Win=85 Len=46 TSval=3350833464 TSecr=2773709327"
240,57:16.8,100.6.0.22,100.6.0.11,TCP,1,66,49370  >  991 [ACK] Seq=1 Ack=921 Win=83 Len=0 TSval=2773710396 TSecr=3350833464
241,57:17.1,100.6.0.14,100.6.0.22,TCP,1,112,"991  >  48900 [PSH, ACK] Seq=875 Ack=1 Win=85 Len=46 TSval=1181324211 TSecr=2456361460"
242,57:17.1,100.6.0.22,100.6.0.14,TCP,1,66,48900  >  991 [ACK] Seq=1 Ack=921 Win=83 Len=0 TSval=2456362647 TSecr=1181324211
243,57:17.5,100.6.0.15,100.6.0.22,TCP,1,96,"991  >  37484 [PSH, ACK] Seq=631 Ack=1 Win=85 Len=30 TSval=1776252420 TSecr=3277226602"
244,57:17.5,100.6.0.22,100.6.0.15,TCP,1,66,37484  >  991 [ACK] Seq=1 Ack=661 Win=83 Len=0 TSval=3277227621 TSecr=1776252420
245,57:17.5,100.6.0.13,100.6.0.22,TCP,1,132,"991  >  38438 [PSH, ACK] Seq=1321 Ack=1 Win=85 Len=66 TSval=2220747621 TSecr=1777466518"
246,57:17.5,100.6.0.22,100.6.0.13,TCP,1,66,38438  >  991 [ACK] Seq=1 Ack=1387 Win=83 Len=0 TSval=1777467570 TSecr=2220747621
247,57:17.6,00:00:00_00:00:0b,00:00:00_00:00:01,ARP,2,42,Who has 100.6.0.11? Tell 100.6.0.22
248,57:17.6,00:00:00_00:00:01,00:00:00_00:00:0b,ARP,2,42,100.6.0.11 is at 00:00:00:00:00:01
249,57:17.9,100.6.0.16,100.6.0.22,TCP,1,124,"991  >  39646 [PSH, ACK] Seq=1161 Ack=1 Win=85 Len=58 TSval=552521955 TSecr=2194159925"
250,57:17.9,100.6.0.22,100.6.0.16,TCP,1,66,39646  >  991 [ACK] Seq=1 Ack=1219 Win=83 Len=0 TSval=2194160951 TSecr=552521955
251,57:17.9,100.6.0.12,100.6.0.22,TCP,1,112,"991  >  39224 [PSH, ACK] Seq=921 Ack=1 Win=85 Len=46 TSval=2091403440 TSecr=2650919373"
252,57:17.9,100.6.0.22,100.6.0.12,TCP,1,66,39224  >  991 [ACK] Seq=1 Ack=967 Win=83 Len=0 TSval=2650920419 TSecr=2091403440
253,57:17.9,100.6.0.11,100.6.0.22,TCP,1,112,"991  >  49370 [PSH, ACK] Seq=921 Ack=1 Win=85 Len=46 TSval=3350834555 TSecr=2773710396"
254,57:17.9,100.6.0.22,100.6.0.11,TCP,1,66,49370  >  991 [ACK] Seq=1 Ack=967 Win=83 Len=0 TSval=2773711487 TSecr=3350834555
255,57:18.1,00:00:00_00:00:0b,00:00:00_00:00:03,ARP,2,42,Who has 100.6.0.13? Tell 100.6.0.22
256,57:18.1,00:00:00_00:00:03,00:00:00_00:00:0b,ARP,2,42,100.6.0.13 is at 00:00:00:00:00:03
257,57:18.1,100.6.0.14,100.6.0.22,TCP,1,112,"991  >  48900 [PSH, ACK] Seq=921 Ack=1 Win=85 Len=46 TSval=1181325231 TSecr=2456362647"
258,57:18.1,100.6.0.22,100.6.0.14,TCP,1,66,48900  >  991 [ACK] Seq=1 Ack=967 Win=83 Len=0 TSval=2456363667 TSecr=1181325231
259,57:18.5,100.6.0.15,100.6.0.22,TCP,1,96,"991  >  37484 [PSH, ACK] Seq=661 Ack=1 Win=85 Len=30 TSval=1776253430 TSecr=3277227621"
260,57:18.5,100.6.0.22,100.6.0.15,TCP,1,66,37484  >  991 [ACK] Seq=1 Ack=691 Win=83 Len=0 TSval=3277228631 TSecr=1776253430
261,57:18.6,100.6.0.13,100.6.0.22,TCP,1,132,"991  >  38438 [PSH, ACK] Seq=1387 Ack=1 Win=85 Len=66 TSval=2220748732 TSecr=1777467570"
262,57:18.6,100.6.0.22,100.6.0.13,TCP,1,66,38438  >  991 [ACK] Seq=1 Ack=1453 Win=83 Len=0 TSval=1777468681 TSecr=2220748732
263,57:18.9,100.6.0.16,100.6.0.22,TCP,1,124,"991  >  39646 [PSH, ACK] Seq=1219 Ack=1 Win=85 Len=58 TSval=552522982 TSecr=2194160951"
264,57:18.9,100.6.0.22,100.6.0.16,TCP,1,66,39646  >  991 [ACK] Seq=1 Ack=1277 Win=83 Len=0 TSval=2194161978 TSecr=552522982
265,57:19.0,100.6.0.12,100.6.0.22,TCP,1,112,"991  >  39224 [PSH, ACK] Seq=967 Ack=1 Win=85 Len=46 TSval=2091404553 TSecr=2650920419"
266,57:19.0,100.6.0.22,100.6.0.12,TCP,1,66,39224  >  991 [ACK] Seq=1 Ack=1013 Win=83 Len=0 TSval=2650921532 TSecr=2091404553
267,57:19.0,100.6.0.11,100.6.0.22,TCP,1,112,"991  >  49370 [PSH, ACK] Seq=967 Ack=1 Win=85 Len=46 TSval=3350835669 TSecr=2773711487"
268,57:19.0,100.6.0.22,100.6.0.11,TCP,1,66,49370  >  991 [ACK] Seq=1 Ack=1013 Win=83 Len=0 TSval=2773712601 TSecr=3350835669
269,57:19.2,100.6.0.14,100.6.0.22,TCP,1,112,"991  >  48900 [PSH, ACK] Seq=967 Ack=1 Win=85 Len=46 TSval=1181326294 TSecr=2456363667"
270,57:19.2,100.6.0.22,100.6.0.14,TCP,1,66,48900  >  991 [ACK] Seq=1 Ack=1013 Win=83 Len=0 TSval=2456364730 TSecr=1181326294
271,57:19.6,100.6.0.15,100.6.0.22,TCP,1,96,"991  >  37484 [PSH, ACK] Seq=691 Ack=1 Win=85 Len=30 TSval=1776254504 TSecr=3277228631"
272,57:19.6,100.6.0.22,100.6.0.15,TCP,1,66,37484  >  991 [ACK] Seq=1 Ack=721 Win=83 Len=0 TSval=3277229705 TSecr=1776254504
273,57:19.6,00:00:00_00:00:0b,00:00:00_00:00:02,ARP,2,42,Who has 100.6.0.12? Tell 100.6.0.22
274,57:19.6,00:00:00_00:00:0b,00:00:00_00:00:05,ARP,2,42,Who has 100.6.0.15? Tell 100.6.0.22
275,57:19.6,00:00:00_00:00:02,00:00:00_00:00:0b,ARP,2,42,100.6.0.12 is at 00:00:00:00:00:02
276,57:19.6,00:00:00_00:00:05,00:00:00_00:00:0b,ARP,2,42,100.6.0.15 is at 00:00:00:00:00:05
277,57:19.9,100.6.0.13,100.6.0.22,TCP,1,132,"991  >  38438 [PSH, ACK] Seq=1453 Ack=1 Win=85 Len=66 TSval=2220749934 TSecr=1777468681"
278,57:19.9,100.6.0.22,100.6.0.13,TCP,1,66,38438  >  991 [ACK] Seq=1 Ack=1519 Win=83 Len=0 TSval=1777469883 TSecr=2220749934
279,57:19.9,00:00:00_00:00:0b,00:00:00_00:00:04,ARP,2,42,Who has 100.6.0.14? Tell 100.6.0.22
280,57:19.9,00:00:00_00:00:0b,00:00:00_00:00:06,ARP,2,42,Who has 100.6.0.16? Tell 100.6.0.22
281,57:19.9,00:00:00_00:00:04,00:00:00_00:00:0b,ARP,2,42,100.6.0.14 is at 00:00:00:00:00:04
282,57:19.9,00:00:00_00:00:06,00:00:00_00:00:0b,ARP,2,42,100.6.0.16 is at 00:00:00:00:00:06
283,57:19.9,100.6.0.16,100.6.0.22,TCP,1,124,"991  >  39646 [PSH, ACK] Seq=1277 Ack=1 Win=85 Len=58 TSval=552524031 TSecr=2194161978"
284,57:19.9,100.6.0.22,100.6.0.16,TCP,1,66,39646  >  991 [ACK] Seq=1 Ack=1335 Win=83 Len=0 TSval=2194163027 TSecr=552524031
285,57:20.0,100.6.0.12,100.6.0.22,TCP,1,112,"991  >  39224 [PSH, ACK] Seq=1013 Ack=1 Win=85 Len=46 TSval=2091405592 TSecr=2650921532"
286,57:20.0,100.6.0.22,100.6.0.12,TCP,1,66,39224  >  991 [ACK] Seq=1 Ack=1059 Win=83 Len=0 TSval=2650922571 TSecr=2091405592
287,57:20.2,100.6.0.11,100.6.0.22,TCP,1,112,"991  >  49370 [PSH, ACK] Seq=1013 Ack=1 Win=85 Len=46 TSval=3350836815 TSecr=2773712601"
288,57:20.2,100.6.0.22,100.6.0.11,TCP,1,66,49370  >  991 [ACK] Seq=1 Ack=1059 Win=83 Len=0 TSval=2773713747 TSecr=3350836815
289,57:20.2,100.6.0.14,100.6.0.22,TCP,1,112,"991  >  48900 [PSH, ACK] Seq=1013 Ack=1 Win=85 Len=46 TSval=1181327327 TSecr=2456364730"
290,57:20.2,100.6.0.22,100.6.0.14,TCP,1,66,48900  >  991 [ACK] Seq=1 Ack=1059 Win=83 Len=0 TSval=2456365763 TSecr=1181327327
291,57:20.6,100.6.0.15,100.6.0.22,TCP,1,96,"991  >  37484 [PSH, ACK] Seq=721 Ack=1 Win=85 Len=30 TSval=1776255580 TSecr=3277229705"
292,57:20.6,100.6.0.22,100.6.0.15,TCP,1,66,37484  >  991 [ACK] Seq=1 Ack=751 Win=83 Len=0 TSval=3277230781 TSecr=1776255580
293,57:21.1,100.6.0.13,100.6.0.22,TCP,1,132,"991  >  38438 [PSH, ACK] Seq=1519 Ack=1 Win=85 Len=66 TSval=2220751165 TSecr=1777469883"
294,57:21.1,100.6.0.22,100.6.0.13,TCP,1,66,38438  >  991 [ACK] Seq=1 Ack=1585 Win=83 Len=0 TSval=1777471114 TSecr=2220751165
295,57:21.1,100.6.0.16,100.6.0.22,TCP,1,124,"991  >  39646 [PSH, ACK] Seq=1335 Ack=1 Win=85 Len=58 TSval=552525230 TSecr=2194163027"
296,57:21.1,100.6.0.22,100.6.0.16,TCP,1,66,39646  >  991 [ACK] Seq=1 Ack=1393 Win=83 Len=0 TSval=2194164226 TSecr=552525230
297,57:21.2,100.6.0.12,100.6.0.22,TCP,1,112,"991  >  39224 [PSH, ACK] Seq=1059 Ack=1 Win=85 Len=46 TSval=2091406751 TSecr=2650922571"
298,57:21.2,100.6.0.22,100.6.0.12,TCP,1,66,39224  >  991 [ACK] Seq=1 Ack=1105 Win=83 Len=0 TSval=2650923730 TSecr=2091406751
299,57:21.3,100.6.0.14,100.6.0.22,TCP,1,112,"991  >  48900 [PSH, ACK] Seq=1059 Ack=1 Win=85 Len=46 TSval=1181328357 TSecr=2456365763"
300,57:21.3,100.6.0.22,100.6.0.14,TCP,1,66,48900  >  991 [ACK] Seq=1 Ack=1105 Win=83 Len=0 TSval=2456366793 TSecr=1181328357
301,57:21.3,100.6.0.11,100.6.0.22,TCP,1,112,"991  >  49370 [PSH, ACK] Seq=1059 Ack=1 Win=85 Len=46 TSval=3350837960 TSecr=2773713747"
302,57:21.3,100.6.0.22,100.6.0.11,TCP,1,66,49370  >  991 [ACK] Seq=1 Ack=1105 Win=83 Len=0 TSval=2773714892 TSecr=3350837960
303,57:21.7,100.6.0.15,100.6.0.22,TCP,1,96,"991  >  37484 [PSH, ACK] Seq=751 Ack=1 Win=85 Len=30 TSval=1776256688 TSecr=3277230781"
304,57:21.7,100.6.0.22,100.6.0.15,TCP,1,66,37484  >  991 [ACK] Seq=1 Ack=781 Win=83 Len=0 TSval=3277231889 TSecr=1776256688
305,57:22.1,100.6.0.13,100.6.0.22,TCP,1,132,"991  >  38438 [PSH, ACK] Seq=1585 Ack=1 Win=85 Len=66 TSval=2220752232 TSecr=1777471114"
306,57:22.1,100.6.0.22,100.6.0.13,TCP,1,66,38438  >  991 [ACK] Seq=1 Ack=1651 Win=83 Len=0 TSval=1777472181 TSecr=2220752232
307,57:22.3,100.6.0.12,100.6.0.22,TCP,1,112,"991  >  39224 [PSH, ACK] Seq=1105 Ack=1 Win=85 Len=46 TSval=2091407848 TSecr=2650923730"
308,57:22.3,100.6.0.22,100.6.0.12,TCP,1,66,39224  >  991 [ACK] Seq=1 Ack=1151 Win=83 Len=0 TSval=2650924827 TSecr=2091407848
309,57:22.3,100.6.0.16,100.6.0.22,TCP,1,124,"991  >  39646 [PSH, ACK] Seq=1393 Ack=1 Win=85 Len=58 TSval=552526415 TSecr=2194164226"
310,57:22.3,100.6.0.22,100.6.0.16,TCP,1,66,39646  >  991 [ACK] Seq=1 Ack=1451 Win=83 Len=0 TSval=2194165411 TSecr=552526415
311,57:22.4,100.6.0.14,100.6.0.22,TCP,1,112,"991  >  48900 [PSH, ACK] Seq=1105 Ack=1 Win=85 Len=46 TSval=1181329461 TSecr=2456366793"
312,57:22.4,100.6.0.22,100.6.0.14,TCP,1,66,48900  >  991 [ACK] Seq=1 Ack=1151 Win=83 Len=0 TSval=2456367897 TSecr=1181329461
313,57:22.4,100.6.0.11,100.6.0.22,TCP,1,112,"991  >  49370 [PSH, ACK] Seq=1105 Ack=1 Win=85 Len=46 TSval=3350838997 TSecr=2773714892"
